{
  "ticket": "WIKI-162",
  "orch": "wiki",
  "template": "wiki.implement",
  "created_at": "2026-07-22T18:00:00Z",
  "updated_at": "2026-07-22T18:00:00Z",
  "nodes": [
    {"id": "N-1", "kind": "orchestrator", "label": "wiki orch"},
    {"id": "N-2", "kind": "implement", "label": "WIKI-162 worker", "worker_id": "WIKI-162", "sha": "0123456"}
  ],
  "edges": [
    {
      "kind": "spawn",
      "from": "N-1",
      "to": "N-2",
      "payload": {
        "ticket": "WIKI-162",
        "role": "implement",
        "model": "gpt-5.6-luna",
        "worktree": "/tmp/wiki-162",
        "request_id": "spawn-1"
      },
      "created_at": "2026-07-22T18:00:00Z"
    }
  ],
  "composite_health": {
    "state": "iterating",
    "open_findings": 0,
    "blocking": 0,
    "slowest_node_stall_seconds": 0,
    "iteration_count": 1
  }
}
